{"affected_component":"scripts.transition-phase","category":"conformance-deviation","event_id":"FE-787be7d6a69b0497e8f59677","evidence_refs":["audit:act-to-archive:70245236f3120fc81b997cf2"],"facts":{"after_state":"archive","before_state":"act","confidence":"observed","exit_code":null,"gate_effect":"blocked"},"idempotency_key":"audit:T0401:act-to-archive:70245236f3120fc81b997cf2","issue_code":"DISPOSITION_MISSING","normalized_location":"audit/disposition_missing-98680e3382494e9b","occurred_at":"2026-08-29T18:29:14+08:00","phase":"act","record_id":"T0401-0829-onto-validate-check","rule":{"id":"transition-audit","version":"v2"},"schema":"pdca.flow-issue-occurrence/v1","source":"transition-audit","summary":"knowledge disposition is required","task_id":"T0401","transition":"act-to-archive"}
