{"affected_component":"scripts.transition-phase","category":"conformance-deviation","event_id":"FE-27dff8b92d07baa69e27903a","evidence_refs":["audit:check-to-act:c8432e4f320c5fd58271235c"],"facts":{"after_state":"act","before_state":"check","confidence":"observed","exit_code":null,"gate_effect":"blocked"},"idempotency_key":"audit:T0362:check-to-act:c8432e4f320c5fd58271235c","issue_code":"CONCLUSION_MISSING","normalized_location":"audit/conclusion_missing-f8f1ab28690f7c07","occurred_at":"2026-08-23T01:13:38+08:00","phase":"check","record_id":"T0362-0823-libobk-hs-netorder","rule":{"id":"transition-audit","version":"v2"},"schema":"pdca.flow-issue-occurrence/v1","source":"transition-audit","summary":"conclusion is required","task_id":"T0362","transition":"check-to-act"}
