{"affected_component":"scripts.transition-phase","category":"conformance-deviation","event_id":"FE-44bcd90235da0f36ecd40c77","evidence_refs":["audit:do-to-check:1b99d1ab485e0f49d2da8a61"],"facts":{"after_state":"check","before_state":"do","confidence":"observed","exit_code":null,"gate_effect":"blocked"},"idempotency_key":"audit:T0451:do-to-check:1b99d1ab485e0f49d2da8a61","issue_code":"CONVERGENCE_MAP_MISSING","normalized_location":"audit/convergence_map_missing-389830333ead1c0a","occurred_at":"2026-08-31T12:13:41+08:00","phase":"do","record_id":"T0451-0831-tls-keygen-uaf-fix","rule":{"id":"transition-audit","version":"v2"},"schema":"pdca.flow-issue-occurrence/v1","source":"transition-audit","summary":"exactly one entry with id and kind convergence-map is required","task_id":"T0451","transition":"do-to-check"}
