{"affected_component":"scripts.transition-phase","category":"conformance-deviation","event_id":"FE-d013e35642d0a06229350a96","evidence_refs":["audit:do-to-check:a1ba8e6897c9975199df6871"],"facts":{"after_state":"check","before_state":"do","confidence":"observed","exit_code":null,"gate_effect":"blocked"},"idempotency_key":"audit:T0163:do-to-check:a1ba8e6897c9975199df6871","issue_code":"ACCEPTANCE_CRITERIA_MISSING","normalized_location":"audit/acceptance_criteria_missing-6e412141465c0151","occurred_at":"2026-07-31T11:21:13+08:00","phase":"do","record_id":"T0163","rule":{"id":"transition-audit","version":"v2"},"schema":"pdca.flow-issue-occurrence/v1","source":"transition-audit","summary":"## 验收标准 must contain Markdown checkboxes","task_id":"T0163","transition":"do-to-check"}
