{"affected_component":"scripts.transition-phase","category":"conformance-deviation","event_id":"FE-f1e79837c39669c15da948bd","evidence_refs":["audit:do-to-check:8647abf4e4430ba766852b95"],"facts":{"after_state":"check","before_state":"do","confidence":"observed","exit_code":null,"gate_effect":"blocked"},"idempotency_key":"audit:T3982:do-to-check:8647abf4e4430ba766852b95","issue_code":"ACCEPTANCE_CRITERION_UNCOVERED","normalized_location":"audit/acceptance_criterion_uncovered-4adb6d5c6a62918c","occurred_at":"2026-08-26T17:38:06+08:00","phase":"do","record_id":"T3982-0826-pgwrecover-common-code-extraction","rule":{"id":"transition-audit","version":"v2"},"schema":"pdca.flow-issue-occurrence/v1","source":"transition-audit","summary":"criterion has no registered support evidence","task_id":"T3982","transition":"do-to-check"}
