{"affected_component":"scripts.transition-phase","category":"conformance-deviation","event_id":"FE-2081427667cc5498beb4eea1","evidence_refs":["audit:check-to-act:e4c603525b7135f5b8989c4b"],"facts":{"after_state":"act","before_state":"check","confidence":"observed","exit_code":null,"gate_effect":"blocked"},"idempotency_key":"audit:T0242:check-to-act:e4c603525b7135f5b8989c4b","issue_code":"VERDICT_MISSING","normalized_location":"audit/verdict_missing-acf7ca09e3c286b8","occurred_at":"2026-08-09T17:14:06+08:00","phase":"check","record_id":"T0242-0809-skills-candidates-review","rule":{"id":"transition-audit","version":"v2"},"schema":"pdca.flow-issue-occurrence/v1","source":"transition-audit","summary":"verdict is required","task_id":"T0242","transition":"check-to-act"}
