{"affected_component":"scripts.transition-phase","category":"conformance-deviation","event_id":"FE-d1c74339a2de75ff8e5f4448","evidence_refs":["audit:do-to-check:f9148e2f75aebb4113ac6d4d"],"facts":{"after_state":"check","before_state":"do","confidence":"observed","exit_code":null,"gate_effect":"blocked"},"idempotency_key":"audit:T0521:do-to-check:f9148e2f75aebb4113ac6d4d","issue_code":"ACCEPTANCE_CRITERION_UNCOVERED","normalized_location":"audit/acceptance_criterion_uncovered-4adb6d5c6a62918c","occurred_at":"2026-09-01T15:03:34+08:00","phase":"do","record_id":"T0521-0903-scenario-gate-hard","rule":{"id":"transition-audit","version":"v2"},"schema":"pdca.flow-issue-occurrence/v1","source":"transition-audit","summary":"criterion has no registered support evidence","task_id":"T0521","transition":"do-to-check"}
