{"affected_component":"scripts.transition-phase","category":"conformance-deviation","event_id":"FE-3ef55cc9309000c2f1d62300","evidence_refs":["audit:check-to-act:ed65045ee4dc754a389afa60"],"facts":{"after_state":"act","before_state":"check","confidence":"observed","exit_code":null,"gate_effect":"blocked"},"idempotency_key":"audit:T0213:check-to-act:ed65045ee4dc754a389afa60","issue_code":"VERDICT_MISSING","normalized_location":"audit/verdict_missing-acf7ca09e3c286b8","occurred_at":"2026-08-04T07:56:06+08:00","phase":"check","record_id":"T0213-0803-rpc-server-epoll-migration","rule":{"id":"transition-audit","version":"v2"},"schema":"pdca.flow-issue-occurrence/v1","source":"transition-audit","summary":"verdict is required","task_id":"T0213","transition":"check-to-act"}
