{"affected_component":"scripts.transition-phase","category":"conformance-deviation","event_id":"FE-4515ff50808963be1f06c186","evidence_refs":["audit:do-to-check:6275ff9fdc8d97b400b5dcb7"],"facts":{"after_state":"check","before_state":"do","confidence":"observed","exit_code":null,"gate_effect":"blocked"},"idempotency_key":"audit:T2085:do-to-check:6275ff9fdc8d97b400b5dcb7","issue_code":"CONVERGENCE_MAP_MISSING","normalized_location":"audit/convergence_map_missing-63af801e88986dc6","occurred_at":"2026-09-09T11:50:07+08:00","phase":"do","record_id":"T2085-0909-tickets-repro-test","rule":{"id":"transition-audit","version":"v2"},"schema":"pdca.flow-issue-occurrence/v1","source":"transition-audit","summary":"exactly one entry with id and kind convergence-map is required","task_id":"T2085","transition":"do-to-check"}
