{"affected_component":"scripts.transition-phase","category":"conformance-deviation","event_id":"FE-1290f9fc8cf8944917c5a9fa","evidence_refs":["audit:do-to-check:7645570f4da6131efcb0bafd"],"facts":{"after_state":"check","before_state":"do","confidence":"observed","exit_code":null,"gate_effect":"blocked"},"idempotency_key":"audit:T3982:do-to-check:7645570f4da6131efcb0bafd","issue_code":"EVIDENCE_FILE_MISSING","normalized_location":"audit/evidence_file_missing-7e4660b57e8024f6","occurred_at":"2026-08-26T17:39:26+08:00","phase":"do","record_id":"T3982-0826-pgwrecover-common-code-extraction","rule":{"id":"transition-audit","version":"v2"},"schema":"pdca.flow-issue-occurrence/v1","source":"transition-audit","summary":"artifact is missing","task_id":"T3982","transition":"do-to-check"}
