{"affected_component":"scripts.transition-phase","category":"conformance-deviation","event_id":"FE-b44e1db78811d22607895e3a","evidence_refs":["audit:check-to-act:04dc96ca990367bacda3c611"],"facts":{"after_state":"act","before_state":"check","confidence":"observed","exit_code":null,"gate_effect":"blocked"},"idempotency_key":"audit:T0367:check-to-act:04dc96ca990367bacda3c611","issue_code":"CONCLUSION_MISSING","normalized_location":"audit/conclusion_missing-83f51a6218e90319","occurred_at":"2026-08-23T09:15:52+08:00","phase":"check","record_id":"T0367-0823-dmsbtex-sbt-config-mtls","rule":{"id":"transition-audit","version":"v2"},"schema":"pdca.flow-issue-occurrence/v1","source":"transition-audit","summary":"conclusion is required","task_id":"T0367","transition":"check-to-act"}
