{"affected_component":"scripts.transition-phase","category":"conformance-deviation","event_id":"FE-86b19142508a75d78ea1d4a1","evidence_refs":["audit:check-to-act:f00ad9ccff294a54aa5ad609"],"facts":{"after_state":"act","before_state":"check","confidence":"observed","exit_code":null,"gate_effect":"blocked"},"idempotency_key":"audit:T0369:check-to-act:f00ad9ccff294a54aa5ad609","issue_code":"VERDICT_MISSING","normalized_location":"audit/verdict_missing-acf7ca09e3c286b8","occurred_at":"2026-08-23T10:39:39+08:00","phase":"check","record_id":"T0369-0823-rdbcfg-config-audit","rule":{"id":"transition-audit","version":"v2"},"schema":"pdca.flow-issue-occurrence/v1","source":"transition-audit","summary":"verdict is required","task_id":"T0369","transition":"check-to-act"}
