{"affected_component":"scripts.transition-phase","category":"conformance-deviation","event_id":"FE-b29f83344fbcc837ff71208d","evidence_refs":["audit:do-to-check:2ceed5403ce164b2bcbb7814"],"facts":{"after_state":"check","before_state":"do","confidence":"observed","exit_code":null,"gate_effect":"blocked"},"idempotency_key":"audit:T0453:do-to-check:2ceed5403ce164b2bcbb7814","issue_code":"ACCEPTANCE_CRITERION_UNCOVERED","normalized_location":"audit/acceptance_criterion_uncovered-ab69c3b8100f1d80","occurred_at":"2026-08-31T13:44:50+08:00","phase":"do","record_id":"T0453-0831-p2-ontology-improvements","rule":{"id":"transition-audit","version":"v2"},"schema":"pdca.flow-issue-occurrence/v1","source":"transition-audit","summary":"criterion must be covered by non-map evidence","task_id":"T0453","transition":"do-to-check"}
