{"affected_component":"scripts.transition-phase","category":"conformance-deviation","event_id":"FE-3050a2351d2e5c0a58a4e1f1","evidence_refs":["audit:do-to-check:96e96453d6330222f6a54729"],"facts":{"after_state":"check","before_state":"do","confidence":"observed","exit_code":null,"gate_effect":"blocked"},"idempotency_key":"audit:T0271:do-to-check:96e96453d6330222f6a54729","issue_code":"ACCEPTANCE_CRITERION_UNCOVERED","normalized_location":"audit/acceptance_criterion_uncovered-5ccf43d6d2b2be5c","occurred_at":"2026-08-15T09:34:56+08:00","phase":"do","record_id":"T0271-0815-gate-compliance-remediation","rule":{"id":"transition-audit","version":"v2"},"schema":"pdca.flow-issue-occurrence/v1","source":"transition-audit","summary":"criterion must be covered by non-map evidence","task_id":"T0271","transition":"do-to-check"}
