{"affected_component":"scripts.transition-phase","category":"conformance-deviation","event_id":"FE-ee84e895e6cc1e46c63fed11","evidence_refs":["audit:plan-to-do:275932458fbc3281fc1d39c6"],"facts":{"after_state":"do","before_state":"plan","confidence":"observed","exit_code":null,"gate_effect":"blocked"},"idempotency_key":"audit:T0210:plan-to-do:275932458fbc3281fc1d39c6","issue_code":"FINAL_CONFIRMATION_MISSING","normalized_location":"audit/final_confirmation_missing-42049414a6269657","occurred_at":"2026-08-03T21:43:34+08:00","phase":"plan","record_id":"T0210-0803-btree-node-sector-persistence","rule":{"id":"transition-audit","version":"v2"},"schema":"pdca.flow-issue-occurrence/v1","source":"transition-audit","summary":"confirmed response is required","task_id":"T0210","transition":"plan-to-do"}
