{"affected_component":"scripts.transition-phase","category":"conformance-deviation","event_id":"FE-666fae8efd2cc1c6d531b5b0","evidence_refs":["audit:do-to-check:5b0c2d9f16d0412add9e1799"],"facts":{"after_state":"check","before_state":"do","confidence":"observed","exit_code":null,"gate_effect":"blocked"},"idempotency_key":"audit:T3969:do-to-check:5b0c2d9f16d0412add9e1799","issue_code":"EVIDENCE_INTEGRITY_UNVERIFIABLE","normalized_location":"audit/evidence_integrity_unverifiable-c475b7aed7bfb3a9","occurred_at":"2026-08-26T10:19:41+08:00","phase":"do","record_id":"T3969-0826-pgwrecover-cleanup-for-multiversion","rule":{"id":"transition-audit","version":"v2"},"schema":"pdca.flow-issue-occurrence/v1","source":"transition-audit","summary":"evidence integrity cannot be verified without a manifest","task_id":"T3969","transition":"do-to-check"}
