{"affected_component":"scripts.transition-phase","category":"conformance-deviation","event_id":"FE-c13d711c61bd65a774f00956","evidence_refs":["audit:do-to-check:5d78bb7a7439c1d01a70992d"],"facts":{"after_state":"check","before_state":"do","confidence":"observed","exit_code":null,"gate_effect":"blocked"},"idempotency_key":"audit:T3982:do-to-check:5d78bb7a7439c1d01a70992d","issue_code":"CONVERGENCE_SUPPORT_MISSING","normalized_location":"audit/convergence_support_missing-9c0b2d10ccc57697","occurred_at":"2026-08-26T17:41:41+08:00","phase":"do","record_id":"T3982-0826-pgwrecover-common-code-extraction","rule":{"id":"transition-audit","version":"v2"},"schema":"pdca.flow-issue-occurrence/v1","source":"transition-audit","summary":"listed evidence does not support AC-3","task_id":"T3982","transition":"do-to-check"}
