{"affected_component":"scripts.transition-phase","category":"conformance-deviation","event_id":"FE-4f897e30a95eb8df85119429","evidence_refs":["audit:do-to-check:e01f498a767f8266ef75f676"],"facts":{"after_state":"check","before_state":"do","confidence":"observed","exit_code":null,"gate_effect":"blocked"},"idempotency_key":"audit:T0432:do-to-check:e01f498a767f8266ef75f676","issue_code":"ACCEPTANCE_CRITERION_UNCOVERED","normalized_location":"audit/acceptance_criterion_uncovered-cf9a871f342e31f6","occurred_at":"2026-08-30T17:33:39+08:00","phase":"do","record_id":"T0432-0830-ontology-ai-efficiency-gap-fill","rule":{"id":"transition-audit","version":"v2"},"schema":"pdca.flow-issue-occurrence/v1","source":"transition-audit","summary":"criterion must be covered by non-map evidence","task_id":"T0432","transition":"do-to-check"}
