{"affected_component":"scripts.transition-phase","category":"conformance-deviation","event_id":"FE-5ff54cb7ab14a48abb980f28","evidence_refs":["audit:do-to-check:0a96dd1c8df6c20a0628d51c"],"facts":{"after_state":"check","before_state":"do","confidence":"observed","exit_code":null,"gate_effect":"blocked"},"idempotency_key":"audit:T2135:do-to-check:0a96dd1c8df6c20a0628d51c","issue_code":"CONVERGENCE_ITEM_UNKNOWN","normalized_location":"audit/convergence_item_unknown-7564d5cebcfb17c1","occurred_at":"2026-09-09T23:03:51+08:00","phase":"do","record_id":"T2135-0910-pdca-ontology-review","rule":{"id":"transition-audit","version":"v2"},"schema":"pdca.flow-issue-occurrence/v1","source":"transition-audit","summary":"index is outside task convergence","task_id":"T2135","transition":"do-to-check"}
