{"affected_component":"scripts.transition-phase","category":"conformance-deviation","event_id":"FE-cadf9b4c029748423411714f","evidence_refs":["audit:plan-to-do:daf93b5ef06548aa1c1881ec"],"facts":{"after_state":"do","before_state":"plan","confidence":"observed","exit_code":null,"gate_effect":"blocked"},"idempotency_key":"audit:T2157:plan-to-do:daf93b5ef06548aa1c1881ec","issue_code":"SCHEMA_INVALID","normalized_location":"audit/schema_invalid-92af206d4de9e07e","occurred_at":"2026-09-11T10:32:43+08:00","phase":"plan","record_id":"T2157-0911-s3tools-sm4-gcm","rule":{"id":"transition-audit","version":"v2"},"schema":"pdca.flow-issue-occurrence/v1","source":"transition-audit","summary":"'source' is a required property","task_id":"T2157","transition":"plan-to-do"}
