{"affected_component":"scripts.transition-phase","category":"conformance-deviation","event_id":"FE-edaaeb4abba2e6f252b5942c","evidence_refs":["audit:plan-to-do:cefe2a759f65835275a11a16"],"facts":{"after_state":"do","before_state":"plan","confidence":"observed","exit_code":null,"gate_effect":"blocked"},"idempotency_key":"audit:T0329:plan-to-do:cefe2a759f65835275a11a16","issue_code":"FINAL_CONFIRMATION_MISSING","normalized_location":"audit/final_confirmation_missing-42049414a6269657","occurred_at":"2026-08-19T16:10:02+08:00","phase":"plan","record_id":"T0329-0820-oracle-datafile-conversion","rule":{"id":"transition-audit","version":"v2"},"schema":"pdca.flow-issue-occurrence/v1","source":"transition-audit","summary":"confirmed response is required","task_id":"T0329","transition":"plan-to-do"}
