{"affected_component":"scripts.transition-phase","category":"conformance-deviation","event_id":"FE-d983fa96de1f3f19715aab1a","evidence_refs":["audit:do-to-check:d96e7155a81fc414d1d5e467"],"facts":{"after_state":"check","before_state":"do","confidence":"observed","exit_code":null,"gate_effect":"blocked"},"idempotency_key":"audit:T0199:do-to-check:d96e7155a81fc414d1d5e467","issue_code":"ACCEPTANCE_CRITERION_UNCOVERED","normalized_location":"audit/acceptance_criterion_uncovered-ab69c3b8100f1d80","occurred_at":"2026-08-02T13:45:53+08:00","phase":"do","record_id":"T0199-0802-concurrency-interleave","rule":{"id":"transition-audit","version":"v2"},"schema":"pdca.flow-issue-occurrence/v1","source":"transition-audit","summary":"criterion has no registered support evidence","task_id":"T0199","transition":"do-to-check"}
